{"trace_id":"tr_audit_001","evidence_refs":["ev_evt_s01_001"],"response_plan_ref":"rp_tr_audit_001","approval_ref":"approval:approved","missing_requirements":[],"report_markdown":"# SecTrace Audit Review\n- trace_id: tr_audit_001\n- audit_status: qualified\n- integrity_check: passed\n- ledger_payload_refs: incident:tr_audit_001, evidence:ev_evt_s01_001, response:rp_tr_audit_001, approval:approved, audit:tr_audit_001\n- missing_requirements: none","ledger_hash":"ec481826f4cafa1b565f24a37e18afa33821aefe98ebd53604a3e41349504ad4","audit_status":"qualified","integrity_check":"passed"}
